,ルーツ,アーツ名,種別,最大Lv,タイミング,判定値,対象,射程,コスト,効果,ルーツ
AD,スライム,スライミーバインド,魔獣、攻撃,3,メジャー,【白兵】,単体,至近,4,対象に素手による白兵攻撃を行なう。この攻撃が命中した場合、対象はあなたと同調状態になり、同調状態の間に対象が行なうあらゆる判定の達成値を-2する。対象はムーブアクションを消費して【FP】を[Lv×5+5]点失うことでのみこの同調状態を解除できる。,ｽﾗｲﾑ
AD,スライム,メタモルハイド,魔獣,3,マイナー,自動成功,自身,なし,3,あなたは隠密状態となる。敵とエンゲージしていても隠密状態になれる。この隠密状態の間、あなたが行なう白兵攻撃の命中判定に+[Lv+1]する。,ｽﾗｲﾑ
AD,スライム,流体移動,魔獣,1,イニシアチブ,自動成功,自身,なし,5,あなたは即座に通常移動か離脱移動を行ない、そのラウンドの間、あなたは白兵攻撃と射撃攻撃に対するドッジを【肉体】で行なえる。《生ける粘体》の効果中、1ラウンドに1回まで使用できる。,ｽﾗｲﾑ
AD,スライム,消化吸収,20、魔獣,5,クリンナップ,自動成功,単体,至近,6,あなたと同調状態のキャラクターのみ対象にできる。対象は[あなたの【肉体】×2+(Lv+1)D6]点の【FP】を失い、あなたは同点の【FP】を回復する。,ｽﾗｲﾑ
AD,スライム,スライムフラッド,0、魔獣、攻撃,5,メジャー,【肉体】,シーン,シーン,罪,対象に素手による白兵攻撃を行なう。この攻撃のダメージに+【肉体】し、この攻撃が命中した対象は即座に狼狽を受ける。1シナリオに1回まで使用できる。,ｽﾗｲﾑ
AD,スライム,ブレイクスローボディ,純血,1,効果参照,自動成功,自身,なし,9,あなたにダメージが適用された直後に使用する。そのダメージを半分(端数切捨て)にする。属性が【肉体】か【技術】の場合は、そのダメージを0にする。《生ける粘体》効果中、1シーンに1回まで使用できる。,ｽﾗｲﾑ
クライシス星人 - 母星を失った宇宙戦闘民族。極めたその力は惑星の破壊も可能と言われる。(『アドヴェント』にて追加)。,,,,,,,,,,,
AD,クライシス星人,宇宙戦闘民族,自動、魔獣,5,常時,自動成功,自身,なし,0,《魔獣化》中、あなたは飛行状態となり、素手の攻撃力を[【肉体】+(Lv×2+2)+1D6]、G値を+[Lv+2]に変更する。あなたの《魔獣化》のコストは+2され、常にあなたの【肉体】を+1、【社会】を-1(最低1)する。,ｸﾗｲｼｽ星人
AD,クライシス星人,オーラアーマー,魔獣,1,常時,自動成功,自身,なし,3,《魔獣化》中、あなたの【肉体】【技術】属性のA値を+【肉体B】する。あなたが素手と名称に「気弾」を含む武器以外の武器を装備していないなら、さらに素手の攻撃力を+【肉体B】し、ダメージ属性を【感情】に変更する。これらは「種別：乗り物」を装備中が効果がない。,ｸﾗｲｼｽ星人
AD,クライシス星人,オーラウェーブ,なし,3,常時,自動成功,自身,なし,1,あなたは名称に「気弾」を含む武器を「命中：0」「行動：-1」として装備でき、マイナーアクションと人間性3点消費でそのメインプロセス中、その武器による攻撃を「対象：範囲」または「対象：[Lv+1]」体に変更できる。,ｸﾗｲｼｽ星人
AD,クライシス星人,オーラチャージ,魔獣,3,効果参照,自動成功,自身,なし,2,あなたが待機を宣言すると同時に使用する。そのラウンド中、あなたが素手または名称に「気弾」を含む武器によっておこなう攻撃の命中判定に+[Lv+1]、ダメージを+[Lv+1]D6する。「種別：乗り物」を装備中は効果がない。,ｸﾗｲｼｽ星人
AD,クライシス星人,メテオスマッシュ,魔獣、攻撃,1,メジャー,【白兵】,単体,至近,3,対象に素手による白兵攻撃を行なう。この攻撃のダメージに+2D6し、1点でもダメージを与えた場合、対象に離脱移動を行なわせる。移動先はあなたが決定する。,ｸﾗｲｼｽ星人
AD,クライシス星人,メテオハンマー,魔獣,5,効果参照,自動成功,単体,遠隔,4,あなたが使用した《メテオスマッシュ》の効果で対象が離脱移動を行なった直後に使用する。あなたは対象と同じエンゲージに即座に移動し、対象は[あなたの【肉体】+(Lv)D6]点の【FP】を失い、狼狽を受ける。1ラウンドに1回まで使用できる。,ｸﾗｲｼｽ星人
AD,クライシス星人,超戦闘形態,20、魔獣,3,マイナー,自動成功,自身,なし,3,そのシーン中、あなたが行なう攻撃のダメージを+【肉体B】する。この効果はLv回まで重複し、「タイミング：ムーブアクション」「タイミング：解放状態」としても使用可能。,ｸﾗｲｼｽ星人
AD,クライシス星人,純粋なる真の戦士,純血,3,常時,自動成功,自身,なし,Lv+3,あなたの【肉体】に+[Lv+2]し、《超戦闘形態》の効果に+1D6(3回分重複すれば計+3D6)する。あなたの《超戦闘形態》は「種別：40、魔獣」となる。,ｸﾗｲｼｽ星人
宇宙海賊,,,,,,,,,,,
GF222,宇宙海賊,スペースパイレーツ,自動、魔獣,1,常時,自動成功,自身,なし,0,《魔獣化》中、あなたの【行動値】を+【技術B】し、あなたは移動を阻害するようなBSを受けていても通常通りに移動が行える。あなたの《魔獣化》のコストは+1される。,宇宙海賊
GF222,宇宙海賊,一切合切いただきだ,なし,1,効果参照,自動成功,自身,なし,3,あなたが参加した戦闘の終了時に使用する。あなたは1D6点の財産点を得て、そのシナリオ中に行なう攻撃のダメージが+1D6される。,宇宙海賊
GF222,宇宙海賊,お頭のひと声,支援,3,判定直後,自動成功,単体,シーン,2,あなた以外の対象が行なった判定の達成値を+2する。それが命中判定なら、さらにその攻撃のダメージに+[あなたの【技術】]する。1ラウンドLv回。,宇宙海賊
GF222,宇宙海賊,海賊式でいくぜ！,魔獣,1,マイナー,自動成功,自身,なし,2,あなたがメインプロセス中に行なう攻撃を「対象：範囲」に変更し、クラードの対象に与えるダメージを+5する。,宇宙海賊
GF222,宇宙海賊,銀河の賞金首,魔獣,3,イニシアチブ,自動成功,範囲,シーン,3,取得時に「恐怖：あなた」か「翻弄：あなた」のいずれかを選択する。対象に選択したBSを与える。1ラウンド1回、1シーンLv回。,宇宙海賊
GF222,宇宙海賊,ボーディングアサルト,魔獣、攻撃,3,メジャー,【白兵】,単体,至近,4,あなたが移動したメインプロセスにのみ使用可能。命中判定に+[Lv+1]、ダメージに+【肉体】して白兵攻撃を行なう。乗り物を装備中にこの攻撃で1点でもダメージを与えた場合、さらに狼狽を与える。,宇宙海賊
GF222,宇宙海賊,捨て身の海賊戦法,20、魔獣,3,イニシアチブ,自動成功,範囲,至近,6,使用には名称に「船」を含む宇宙海賊装備の取得が必要(装備している必要はない)。あなたと対象の【FP】を[【技術】+(Lv×2)D6]点失わせ、そのラウンド中対象が行なう判定の達成値に-3。1シナリオ1回。,宇宙海賊
GF222,宇宙海賊,大いなるお宝,純血、魔獣,1,効果参照,自動成功,自身,なし,愛,罪の効果と同時に使用する。それによって増加するダメージと回復する【FP】に+5D6、増加する達成値に+2D6する。1シナリオ1回。,宇宙海賊
綺士(リッター),,,,,,,,,,,
GF226,綺士,天翔ける綺士,選択,5,常時,自動成功,自身,なし,3,あなたの【FP】最大値を+[Lv×5+10]する。あなたが綺士以外のルーツを持たない場合、キャラクター作成時に常備化経験点の合計が[本来の値+10]点までのアイテムを取得できる。,綺士
GF226,綺士,異能綺士(サイコリッター),魔獣,1,効果参照,自動成功,自身,なし,2,あなたが攻撃を行なう直前に使用。そのダメージを感情属性に変更し、1点でもダメ―ジを与えた場合さらに放心を与える。その命中判定でファンブルした場合、2D6点の【FP】を失う。,綺士
GF226,綺士,ソニッククルセイド,魔獣,1,ムーブ,自動成功,自身,なし,3,あなたは飛行状態で通常移動か離脱移動を行い、このメインプロセスにあなたが行なう白兵攻撃のダメージに+【肉体B】する。,綺士
GF226,綺士,誅伐の刃,魔獣、攻撃,1,メジャー,【白兵】,範囲,武器,2,範囲の対象に、綺士装備による白兵攻撃を行なう。この攻撃でクラード及び「種別：軍団」の武器を装備中の対象に与えるダメージは+【技術B】される。,綺士
GF226,綺士,討滅の請願,魔獣,1,DR直後,自動成功,自身,なし,2,あなたがDRを行なった直後に使用する。DRのダイスのうち【技術B】個までの任意のダイスを振りなおす。1ラウンドにLv回まで使用できる。,綺士
GF226,綺士,リフレクトバラージ,魔獣,3,リアクション,効果参照,自身,なし,3,あなたはドッジを[【白兵値】+2]で行なう、このアーツにより射撃を回避した場合攻撃を行なった相手は攻撃後に[あなたの【白兵値】]点の【FP】を失う。1ラウンドLv回。,綺士
GF226,綺士,最後の聖務,20、魔獣,1,効果参照,自動成功,自身,なし,6,攻撃によってあなたの【FP】が0になった直後に特別に使用できる。あなたは即座にメジャーアクションを1回行える。この時、必ず攻撃を行なう事。1シーン1回。,綺士
GF226,綺士,聖綺剣技,純血、魔獣、攻撃,3,メジャー,【白兵】,単体,武器,7,対象に綺士装備による白兵攻撃を行なう。この攻撃のダメージに+[【最大FP】-【FP】]する。1シナリオLv回まで使用でき、対象は単体から変更できない。,綺士
GF231,綺士,聖骸機操者,選択、ア,1,常時,自動成功,自身,なし,4,あなたは「種別：乗り物(ギア)」の綺士装備ひとつを選択し取得する。これは《魔獣化》と同時もしくは魔獣化中にセットアッププロセスに宣言することで即座に装備または交換できる。また、《魔獣化》中のみ使用でき、装備中は「種別：巨大」として扱われる。,綺士
GF231,綺士,アンカーウェッジ射出,魔獣,1,ムーブ,自動成功,自身,なし,2,「聖骸機：〇〇」を装備中のみ使用可能。そのシーン中、あなたは狼狽を受けず、あなたが行なう射撃攻撃の命中判定に+2、白兵攻撃の命中に-2する。あなたが移動した場合、効果は解除される。,綺士
GF231,綺士,巨腕投擲,魔獣,1,効果参照,自動成功,単体,至近,3,「聖骸機：〇〇」を装備中、白兵攻撃で対象に1点でもダメージを与えた直後に使用。対象に離脱移動を行わせる。移動先はあなたが決定し、移動先のエンゲージにいる他のキャラクター全ては[対象の【肉体B】(対象が巨人なら+5)]点の【FP】を失う。1ラウンド1回。,綺士
GF231,綺士,サイコフィールド全開,魔獣,1,効果参照,自動成功,範囲,至近,4,《異能綺士》を持つか「聖骸機：〇〇」を装備中、あなたがガードを宣言した時に使用。直後のDR中、対象のG値を+[1D6+【技術B】]し、対象は特殊攻撃に対してもガードを行える。,綺士
GF231,綺士,テレポートストライク,魔獣,1,効果参照,自動成功,自身,なし,2,あなたの移動直前に使用。その移動で離脱移動を行なう事ができ、そのメインプロセスに行なう白兵攻撃の命中判定に+2する。「聖骸機：〇〇」を装備中に使用した場合コストが+2され、移動後のエンゲージにいる敵全ては【肉体B】点の【FP】を失う。,綺士
GF231,綺士,亡霊のささやき,魔獣,1,判定直後,自動成功,自身,なし,1,「聖骸機：〇〇」を装備中、あなたが行なった命中判定かドッジを振りなおす。1度の判定に1回のみ使用でき、振りなおしてファンブルかクリティカルが発生した場合、あなたは人間性を2点失う。,綺士
GF231,綺士,骸霊憑機,20、魔獣,3,効果参照,自動成功,自身,なし,0,「聖骸機：〇〇」を装備中、あなたがかりそめの死から回復した直後に使用する。シーン中、あなたが行なうあらゆる判定の達成値に+3、攻撃のダメージに+[Lv+1]D6し、判定を行なうたびに2点の人間性を失う。,綺士
GF231,綺士,暴君を討つ者,0、魔獣,1,イニシアチブ,自動成功,自身,なし,3,このアーツはあなたが「種別：巨大」である間は使用できない。そのシーン中、あなたが攻撃によってドミネーター及び「種別：巨大」に与えるダメージを+【肉体】する。解放状態の間、このアーツは人間性が0以下でなくとも使用可能。,綺士